{
  "schemaVersion": 1,
  "catalogVersion": "test-2026.08.18.1",
  "generatedAt": "2026-08-18T00:00:00+08:00",
  "providers": [
    {
      "providerId": "openai",
      "displayName": "OpenAI",
      "baseUrl": "https://happycodeai.com",
      "defaultModelId": "gpt-5.6-terra",
      "models": [
        {
          "modelId": "gpt-5.6-terra",
          "contextWindowTokens": 200000,
          "maxOutputTokens": 32000,
          "defaultCompressionThresholdPercent": 70,
          "inputModalities": ["text", "image"],
          "outputModalities": ["text"],
          "supportsStreaming": true,
          "supportsReasoningEffort": true,
          "reasoningEffortOptions": ["minimal", "low", "medium", "high", "xhigh", "max"],
          "defaultReasoningEffort": "xhigh",
          "webSearch": { "mode": "openai_web_search_options", "defaultEnabled": false },
          "timeouts": { "readMs": 180000 }
        },
        {
          "modelId": "gpt-5.6-sol",
          "contextWindowTokens": 200000,
          "maxOutputTokens": 32000,
          "defaultCompressionThresholdPercent": 70,
          "inputModalities": ["text", "image"],
          "outputModalities": ["text"],
          "supportsStreaming": true,
          "supportsReasoningEffort": true,
          "reasoningEffortOptions": ["minimal", "low", "medium", "high", "xhigh", "max"],
          "defaultReasoningEffort": "xhigh",
          "webSearch": { "mode": "openai_web_search_options", "defaultEnabled": false },
          "timeouts": { "readMs": 180000 }
        }
      ]
    }
  ]
}
